{
  "name": "dp-cto",
  "version": "2.1.3",
  "description": "CTO orchestration layer â€” /dp-cto:start for brainstorming and planning, /dp-cto:execute for parallel implementation with Agent Teams, /dp-cto:ralph for iterative loops, /dp-cto:verify for research validation. Complementary to superpowers.",
  "author": {
    "name": "Mrugesh",
    "email": "m@raisedadead.com"
  },
  "repository": "https://github.com/raisedadead/dotplugins",
  "keywords": [
    "cto",
    "orchestration",
    "agent-teams",
    "iterative-loops",
    "planning",
    "research-validation"
  ]
}
